<?xml version="1.0" encoding="UTF-8"?>
<usergroup xmlns:xsi="http://www.w3.org/2001/XMLSchema-instance" xsi:noNamespaceSchemaLocation="../xsd/usergroup.xsd"
           female="false">
    <name>Webmontag Frankfurt</name>
    <nickname>WMFRA</nickname>
    <description>Der Webmontag Frankfurt bringt Anwender, Entwickler, Gründer, Unternehmer, Venture Capitalists,
        Forscher, Web-Pioniere, Blogger, Podcaster, Designer und sonstige Interessenten zum Thema Web 2.0 zusammen. Die
        Veranstaltung ist kostenlos und findet immer am 2. Montag im Monat statt.
    </description>
    <url>http://www.wmfra.de/</url>
    <tags>
        <tag>Internet</tag>
    </tags>
    <contact>
        <twitter>@wmfra</twitter>
        <hashtag>#wmfra</hashtag>
        <facebook>http://www.facebook.com/wmfra</facebook>
        <googleplus>https://plus.google.com/110561795970285494597</googleplus>
    </contact>
    <defaultmeetinglocation>
        <name>Brotfabrik Hausen e.V.</name>
        <description>Die Brotfabrik im Stadtteil Hausen von Frankfurt am Main ist ein selbstverwaltetes Zentrum in einer
            ehemaligen Brotfabrik (bis 1962). Insgesamt elf verschiedene Projekte teilen sich fast 1500 m².
            Neben zwei Bühnen gibt es noch einen großen Veranstaltungssaal in dem regelmässig die Konzerte stattfindent,
            zwei Lokale mit gutem Essen, drei psychosoziale Projekte, eine Werbeagentur und ein Atelier.
        </description>
        <url>http://www.brotfabrik.info/</url>
        <twitter>@brotfabrik</twitter>
        <publictransport>U6/U7 in Richtung Heerstraße/Hausen. Nachtbus: N6/7. Haltestellen: Industriehof / Fischstein /
            Große Nelkenstraße
        </publictransport>
        <street>Bachmannstr. 2-4</street>
        <zip>60488</zip>
        <city>Frankfurt</city>
    </defaultmeetinglocation>
    <schedule usedefaultmeetinglocation="true">
        <meeting>
            <time>2014-01-13T19:00:00</time>
            <name>Webmontag #56: Aufbruch</name>
            <url>http://www.wmfra.de/programm/webmontag-frankfurt-56-schwerpunkt-aufbruch.html</url>
        </meeting>
        <meeting>
            <time>2014-02-10T19:00:00</time>
            <name>Webmontag #57: Sicherheit</name>
            <url>http://www.wmfra.de/programm/webmontag-frankfurt-57-schwerpunkt-sicherheit.html</url>
        </meeting>
        <meeting>
            <time>2014-03-10T19:00:00</time>
            <name>Webmontag #58: Un:Normal</name>
            <url>http://www.wmfra.de/programm/webmontag-frankfurt-58-schwerpunkt-un-normal.html</url>
        </meeting>
        <meeting>
            <time>2014-05-12T19:00:00+02:00</time>
            <name>Webmontag #60: Wahrheit oder Pflicht</name>
        </meeting>
        <meeting>
            <time>2014-06-16T19:00:00+02:00</time>
            <name>Webmontag #61: Summer Games</name>
        </meeting>
        <meeting>
            <time>2014-07-14T19:00:00+02:00</time>
            <name>Webmontag #62: Was Hänschen nicht lernt…</name>
        </meeting>
        <meeting>
            <time>2014-08-11T19:00:00+02:00</time>
            <name>Webmontag #63: World Wide Web</name>
        </meeting>
        <meeting>
            <time>2014-09-08T19:00:00+02:00</time>
            <name>Webmontag #64: Bei Risiken und Nebenwirkungen</name>
        </meeting>
        <meeting>
            <time>2014-10-13T19:00:00+02:00</time>
            <name>Webmontag #65: Der Geist in der Maschine</name>
        </meeting>
        <meeting>
            <time>2014-11-10T19:00:00</time>
            <name>Webmontag #66: Geld oder Liebe</name>
        </meeting>
        <meeting>
            <time>2014-12-08T19:00:00</time>
            <name>Webmontag #67: Super Webmontag 67</name>
        </meeting>
        <meeting>
            <time>2014-04-14T19:00:00+02:00</time>
            <name>Webmontag #59: Ignite</name>
            <description>15 Sekunden bestimmen den Rhythmus des nächsten Webmontag Frankfurt: 15 Sekunden – genau so
                lange hat jeder Sprecher Zeit, jede seiner 20 Vortragsfolien in einer 5-minütigen Präsentation zu
                kommentieren, bevor automatisch auf die nächste Folie gewechselt wird.

                Dieses Veranstaltungsformat nennt sich Ignite und lässt die Sprecher das Wesentliche in kürzester Zeit
                auf den Punkt bringen. Den Zuhörern bringt es ein Feuerwerk an Inspirationen zu zahlreichen
                interessanten Themen rund um’s Web.
            </description>
            <url>http://www.wmfra.de/programm/webmontag-frankfurt-59-ignite.html</url>
        </meeting>
        <meeting>
            <time>2013-03-11T19:00:00</time>
            <name>Webmontag #46: Cloud &amp; Big Data</name>
        </meeting>
        <meeting>
            <time>2013-04-08T19:00:00+02:00</time>
            <name>Webmontag #47: ignite</name>
        </meeting>
        <meeting>
            <time>2013-05-13T19:00:00+02:00</time>
            <name>Webmontag #48: Medien</name>
        </meeting>
        <meeting>
            <time>2013-06-10T19:00:00+02:00</time>
            <name>Webmontag #49: StartUp</name>
        </meeting>
        <meeting>
            <time>2013-07-08T19:00:00+02:00</time>
            <name>Webmontag #50: Code</name>
        </meeting>
        <meeting>
            <time>2013-08-12T19:00:00+02:00</time>
            <name>Webmontag Frankfurt #51, Schwerpunkt Neuland</name>
            <description>PRISM, Tempora, Supergrundrecht, Datenschutz und das alles im Neuland. Aus aktuellem Anlass
                ändern wir unser Programm für den Monat August und laden Sprecher ein, die euch zum Thema Datenschutz,
                Netzpolitik und Internet auf den neusten Stand bringen und euch praktische Tipps im Umgang mit euren
                Daten geben.
            </description>
            <url>http://www.wmfra.de/programm/webmontag-frankfurt-51-schwerpunkt-neuland.html</url>
        </meeting>
        <meeting>
            <time>2013-09-09T19:00:00+02:00</time>
            <name>Webmontag #52: Mobility</name>
            <description>Taxi, Bahn, Flug und sogar die Raumfahrt, das breite Spektrum der Mobilität kombiniert mit
                digitaler Technologie, sozialen Medien und dem vernetzten Leben verspricht Spannung, Leidenschaft und
                Innovationen. An diesem Abend möchten wir euch einige interessante Aspekte der Mobilität in 2013 näher
                bringen.
            </description>
        </meeting>
        <meeting>
            <time>2013-10-14T19:00:00+02:00</time>
            <name>Webmontag #53: ignite</name>
        </meeting>
        <meeting>
            <time>2013-11-11T19:00:00</time>
            <name>Webmontag #54: Future of Work</name>
        </meeting>
        <meeting>
            <time>2013-12-09T19:00:00</time>
            <name>Webmontag #55: RheinMainRocks</name>
        </meeting>
    </schedule>
</usergroup>
