<?xml version="1.0" encoding="UTF-8"?>
<usergroup xmlns:xsi="http://www.w3.org/2001/XMLSchema-instance" xsi:noNamespaceSchemaLocation="../xsd/usergroup.xsd"
           female="false">
    <name>Chaos Computer Club Frankfurt e.V.</name>
    <nickname>CCCFFM</nickname>
    <description>Wir sind eine Gruppe von Leuten, die sich teilweise schon seit Jahren wöchentlich zum Meinungs-,
        Erfahrungs- und Wissensaustausch treffen. Themen sind hierbei im Wesentlichen Computer und digitale
        Kommunikation, Technik allgemein, gesellschaftliche Auswirkungen und Veränderungen hierdurch, Kunst, Kultur und
        Bildung im technischen Umfeld, Spaß am Gerät (siehe dazu auch unsere Satzung).
        Dazu treffen wir uns jeden Donnerstag öffentlich im Hackquarter wozu auch Nicht-Mitglieder jederzeit willkommen
        sind – wir freuen uns immer über neue Leute! An anderen Tagen unternehmen wir auch schon mal spontan was in
        kleineren Gruppen.
        Seit November 2010 haben wir unseren eigenen Hackerspace (das Hackquarter) in der Kommunikationsfabrik. Hier
        kann man zusammen löten, diskutieren, klönen, ohne daß man kurz nach Mitternacht nach Hause geschickt wird, und
        kann z.B. während der Laufzeit von Projekten auch schon mal Sachen dort lassen.
        Als Erfahrungsaustauschkreis (Erfa) des CCC e.V. pflegen wir auch den Austausch mit anderen Erfas, Chaostreffs
        und Gruppen der Chaos-Familie, nehmen mehr oder weniger aktiv an vielen Chaos-Events teil und führen mit Anderen
        aus der Region die jährlichen MetaRheinMain Chaosdays als Mitveranstalter durch. Für nähere Infos könnt Ihr uns
        am besten im IRC besuchen oder an unserer Mailingliste teilnehmen. Oder Ihr kommt einfach mal donnerstags ins
        Hackquarter.
    </description>
    <url>http://ccc-ffm.de/</url>
    <tags>
        <tag>Chaos-Computer-Club</tag>
        <tag>Hackerspace</tag>
        <tag>Technik-Kultur-Gesellschaft</tag>
    </tags>
    <contact>
        <mailinglist>
            <url>http://lists.ccc-ffm.de/listinfo/public</url>
            <label>öffentliche Mailingliste</label>
        </mailinglist>
        <twitter>@cccffm</twitter>
    </contact>
    <defaultmeetinglocation>
        <name>CCCFFM - HQ</name>
        <description>Unsere Treffen finden in unserem Hackerspace dem sog. HQ statt</description>
        <url>https://ccc-ffm.de/hackerspace/</url>
        <publictransport>Vom Hauptbahnhof kommend erreicht man das Hackquarter mit den 
            Staßenbahnlinien 11 (Richtung Zuckschwerdtstraße) oder 21 (Richtung Mönchhofstraße oder Nied Kirche)  
            bis zur Haltestelle Mönchhofstraße.
            An der Ampel, die sich direkt an die Haltestelle anschließt überquert man die Mainzer Straße,
            nach rechts (von der Tram kommend) und folgt dann der Schmidtstraße für ca. 300 Meter. 
            Schließlich erreicht man eine große Einfahrt mit zwei (offenen) Schranken. Dort läuft man in den Hof und geht in den “Haupteingang”
        
            Kommt man mit der S3, S4, S5 oder S6  fährt man mit der S-Bahn bis zur Haltestelle Galluswarte und steigt dort in eine der oben genannten Straßenbahnen um.

           Aus der Innenstadt kommend ist es sinnvoll mit einer der genannten S-Bahnen bis zur Galluswarte zu fahren und dort in eine der entsprechenden Straßenbahnen umzusteigen.
                   
        </publictransport>
        <street>Schmidtstraße 12</street>
        <zip>60326</zip>
        <city>Frankfurt am Main</city>
    </defaultmeetinglocation>
    <schedule usedefaultmeetinglocation="true">
        <ical>https://ccc-ffm.de/feed/my-calendar-ics/</ical>
    </schedule>
</usergroup>
