<?xml version="1.0" encoding="UTF-8"?>
<usergroup xmlns:xsi="http://www.w3.org/2001/XMLSchema-instance" xsi:noNamespaceSchemaLocation="../xsd/usergroup.xsd">
    <name>MongoDB User Group Frankfurt Rhein-Main</name>
    <description>Ziel dieser Gruppe ist der regelmäßige Informationsaustausch zwischen MongoDB-Usern aus dem Großraum
        Frankfurt (und auch gerne darüber hinaus). Wir wollen im Rahmen einer Vortragsserie unsere MongoDB-Projekte
        vorstellen, diskutieren und unsere Erfahrungen weitergeben.
    </description>
    <url>http://www.meetup.com/Frankfurt-Rhine-Main-MongoDB-User-Group/</url>
    <!-- url>https://www.xing.com/net/mongodb-ffm/</url -->
    <tags>
        <tag>MongoDB</tag>
    </tags>
    <schedule>
        <meeting>
            <time>2013-07-30T19:00:00+02:00</time>
            <name>#2 - Sommer-Stammtisch</name>
            <url>https://www.xing.com/events/mug-rhein-main-2-sommer-stammtisch-1274536</url>
            <location>
                <name>DEPOT 1899</name>
                <url>http://www.depot1899.de/</url>
                <foursquare>https://de.foursquare.com/v/depot-1899/4b0adcb2f964a520152923e3</foursquare>
                <street>Textorstraße 33</street>
                <zip>60594</zip>
                <city>Frankfurt</city>
            </location>
        </meeting>
        <meeting>
            <time>2013-04-24T19:00:00+02:00</time>
            <name>#1 - MongoDB Replication/Sharding</name>
            <url>http://www.meetup.com/Frankfurt-Rhine-Main-MongoDB-User-Group/events/111519292/</url>
            <location>
                <name>Ibis Hotel Mainz City</name>
                <street>Holzhofstrasse 2</street>
                <zip>55116</zip>
                <city>Mainz</city>
            </location>
        </meeting>
        <meeting>
            <time>2013-03-20T19:00:00</time>
            <name>MongoDB Stammtisch</name>
            <url>https://www.xing.com/events/mongodb-stammtisch-1220268</url>
            <location>
                <name>Kaminzimmer im Eschenheimer</name>
                <url>www.eschenheimer.de</url>
                <street>Eschenheimer Turm</street>
                <zip>60318</zip>
                <city>Frankfurt</city>
            </location>
        </meeting>
    </schedule>
</usergroup>

