<?xml version="1.0" encoding="UTF-8" ?>
<usergroup xmlns:xsi="http://www.w3.org/2001/XMLSchema-instance"
           xsi:noNamespaceSchemaLocation="../xsd/usergroup.xsd" female="false">
    <name>WordPress Meetup Frankfurt</name>
    <nickname>WPFRA</nickname>
    <description>Das WordPress Meetup Frankfurt ist ein lockeres Treffen von WordPress-Fans, die sich mit WordPress
        beschäftigen. Der ungezwungene Austausch zum Thema WordPress steht im Vordergrund, daneben gehören auch kurze,
        themenbezogene Talks zum Programm. Willkommen ist jede und jeder, die oder der sich für WordPress interessiert –
        egal, ob Anwender, Designer, Entwickler, SEOs, Marketeers oder Hobby-Blogger. Unsere WP Meetups sind
        ausdrücklich keine Akquise-Veranstaltungen! Wir legen Wert auf einen offenen, ungezwungenen Austausch und
        bitten, dass alle Teilnehmenden dies berücksichtigen.
    </description>
    <url>https://wpmeetup-frankfurt.de/</url>
    <tags>
        <tag>WordPress</tag>
        <tag>PHP</tag>
    </tags>
    <contact>
        <twitter>@WPFRA</twitter>
        <hashtag>#WPFRA</hashtag>
        <meetup>http://www.meetup.com/wpmeetup-frankfurt/</meetup>
    </contact>
    <defaultmeetinglocation>
        <name>moenus+friends</name>
        <url>https://moenus.net/</url>
	<publictransport>Die Räumlichkeiten von moenus+friends finden sich in der Nähe vom Zoo Frankfurt/Ostendstraße.</publictransport>
        <street>Friedberger Anlage 8 (Hinterhaus)</street>
        <zip>60314</zip>
        <city>Frankfurt</city>
    </defaultmeetinglocation>
    <schedule usedefaultmeetinglocation="true">
        <ical>https://www.meetup.com/wpmeetup-frankfurt/events/ical</ical>
    </schedule>
</usergroup>
