<?xml version="1.0" encoding="UTF-8"?>
<usergroup xmlns:xsi="http://www.w3.org/2001/XMLSchema-instance" xsi:noNamespaceSchemaLocation="../xsd/usergroup.xsd"
           plural="true">
    <name>Digital Media Women Frankfurt</name>
    <nickname>DMWffm</nickname>
    <description>Die Digital Media Women (DMW) sind ein in Hamburg gegründetes Branchennetzwerk und seit Juli 2012 ein
        eingetragener Verein. Wir arbeiten im und mit dem Netz: als Social Media Managerinnen, Web- und
        Grafikdesignerinnen, Online-Journalistinnen, Bloggerinnen, Programmiererinnen und in vielen anderen Feldern des
        World Wide Web. Unsere Arbeitsfelder sind oft Männerdomänen – doch wir wollen die Situation von Frauen in
        unseren Berufen verbessern und unsere Expertise unter Beweis stellen.

        Digital Media Women sind wissenshungrig und überzeugt, dass Wissen wächst, wenn man es teilt. Wir wollen stets
        dazu lernen. Dafür reisen wir zu Barcamps oder Branchenkonferenzen wie der re:publica, besuchen Vorträge und
        veranstalten selbst welche. Wir verstehen uns nicht bloß als passive Zuschauerinnen, wir wollen Impulse geben
        und vorne mit dabei sein. Ein wichtiges Ziel der DMW ist, mehr Frauen auf die Podien der männerdominierten
        Konferenzwelt zu bringen.

        Allen Digital Media Women steht ein dichtes Netzwerk kompetenter Frauen offen. Wir bieten neue Kontakte und
        Kommunikation auf professioneller Ebene – online und offline. Die DMW treffen sich, um gemeinsam berufliche
        Projekte voranzutreiben, neuen Input zu erfahren, einander Tipps und Empfehlungen zu geben oder einfach nur zum
        gemütlichen Austausch unter Gleichgesinnten. In der Community findest du geballte Kompetenz von inzwischen mehr
        als 600 Frauen aus ganz Deutschland – und übrigens auch Männern, die unsere Anliegen unterstützen.
    </description>
    <url>http://www.digitalmediawomen.de/</url>
    <tags>
        <tag>Media</tag>
        <tag>Women</tag>
        <tag>Digital</tag>
    </tags>
    <contact>
        <twitter>@DigiWomenDE</twitter>
        <hashtag>#dmwFFM</hashtag>
        <facebook>https://www.facebook.com/DigitalMediaWomen</facebook>
    </contact>
    <schedule>
        <meeting>
            <time>2013-03-04T19:00:00</time>
            <name>2. Gründungstreffen der #dmwffm</name>
            <description>Seit Anfang des Jahres werkeln wir daran, die #dmwffm zu einer festen, verlässlichen Größe im
                digitalen Geschehen des Rhein-Main-Gebiets zu machen. Deswegen laden wir euch ein, mit uns gemeinsam
                großartige Ideen weiterzudenken, angesagte Themen heiß zu diskutieren und neue Dinge in Bewegung zu
                bringen. Wir möchten euch gerne von unseren Ideen begeistern und mit unserem Elan anstecken – und uns
                von eurem Esprit und eurer Kreativität inspirieren lassen. Jetzt ist die richtige Zeit, um sich zu
                engagieren und einzubringen!
            </description>
            <location>
                <name>Hotwire Public Relations Germany GmbH</name>
                <description>Eingang über Weißfrauenstr. 12-16</description>
                <url>http://www.hotwirepr.de/</url>
                <twitter>@hotwired</twitter>
                <street>Friedensstr. 6-10</street>
                <zip>60311</zip>
                <city>Frankfurt</city>
            </location>
        </meeting>
    </schedule>
</usergroup>
