<?xml version="1.0" encoding="UTF-8"?>
<usergroup xmlns:xsi="http://www.w3.org/2001/XMLSchema-instance" xsi:noNamespaceSchemaLocation="../xsd/usergroup.xsd">
    <name>PHP UG Rheinhessen</name>
    <nickname>PHPUGRHH</nickname>
    <description>Wir sind eine Gruppe von PHP interessierten Entwicklern. Unser Interesse besteht im gegenseitigen
        Austausch von Wissen und Erfahrungsberichten. Jeder Interessierte ist willkommen, sich bei unserer Gruppe zu
        beteiligen.
    </description>
    <url>http://www.phpug-rheinhessen.de/</url>
    <tags>
        <tag>PHP</tag>
    </tags>
    <contact>
        <twitter>@phpugrhh</twitter>
        <hashtag>#phpugrhh</hashtag>
        <facebook>http://www.facebook.com/group.php?gid=192655655785</facebook>
        <xing>https://www.xing.com/net/pri3a328cx/phpugrhh/</xing>
    </contact>
    <schedule>
        <meeting>
            <time>2013-03-05T19:00:00+01:00</time>
            <name>23. Treffen der PHP User Group Rheinhessen</name>
            <url>https://www.xing.com/events/23-treffen-phpug-rheinhessen-1205190</url>
            <location>
                <name>NIDAG GmbH</name>
                <url>http://www.nidag.com/</url>
                <publictransport>Bus 58 und 70 bis Haltestelle Feldbergplatz/Stadtwerke Mainz AG</publictransport>
                <street>Taunusstra√üe 59-61</street>
                <zip>55120</zip>
                <city>Mainz</city>
            </location>
        </meeting>
    </schedule>
    <sponsors>
        <sponsor>
            <name>netz98 new media GmbH</name>
            <url>http://www.netz98.de/</url>
        </sponsor>
        <sponsor>
            <name>NIDAG GmbH</name>
            <url>http://www.nidag.com/</url>
        </sponsor>
    </sponsors>
    <photocredits>
        <logo>Das Logo stammt von UG-Mitglied [Lukas Giebel](https://plus.google.com/102794229174790604056/about)</logo>
    </photocredits>
</usergroup>
